vllm_metax/model_executor/layers/fused_moe/configs/H=2048,E=60,N=1408,device_name=MXC500.json
{
  "1": {
    "stage1": {
      "BLOCK_SIZE_M": 16,
      "BLOCK_SIZE_N": 32,
      "BLOCK_SIZE_K": 64,
      "GROUP_SIZE_M": 1,
      "num_warps": 4,
      "num_stages": 3,
      "pipeline": "basic",
      "scenario": "",
      "ACCF32": false,
      "SPLIT_K": 1
    },
    "stage2": {
      "BLOCK_SIZE_M": 16,
      "BLOCK_SIZE_N": 32,
      "BLOCK_SIZE_K": 64,
      "GROUP_SIZE_M": 1,
      "num_warps": 4,
      "num_stages": 3,
      "pipeline": "basic",
      "scenario": "",
      "ACCF32": false,
      "SPLIT_K": 1
    }
  },
  "8": {
    "stage1": {
      "BLOCK_SIZE_M": 16,
      "BLOCK_SIZE_N": 32,
      "BLOCK_SIZE_K": 64,
      "GROUP_SIZE_M": 1,
      "num_warps": 4,
      "num_stages": 3,
      "pipeline": "basic",
      "scenario": "",
      "ACCF32": false,
      "SPLIT_K": 1
    },
    "stage2": {
      "BLOCK_SIZE_M": 16,
      "BLOCK_SIZE_N": 32,
      "BLOCK_SIZE_K": 64,
      "GROUP_SIZE_M": 1,
      "num_warps": 4,
      "num_stages": 3,
      "pipeline": "basic",
      "scenario": "",
      "ACCF32": false,
      "SPLIT_K": 1
    }
  },
  "16": {
    "stage1": {
      "BLOCK_SIZE_M": 16,
      "BLOCK_SIZE_N": 32,
      "BLOCK_SIZE_K": 64,
      "GROUP_SIZE_M": 1,
      "num_warps": 4,
      "num_stages": 3,
      "pipeline": "basic",
      "scenario": "",
      "ACCF32": false,
      "SPLIT_K": 1
    },
    "stage2": {
      "BLOCK_SIZE_M": 16,
      "BLOCK_SIZE_N": 32,
      "BLOCK_SIZE_K": 64,
      "GROUP_SIZE_M": 1,
      "num_warps": 4,
      "num_stages": 3,
      "pipeline": "basic",
      "scenario": "",
      "ACCF32": false,
      "SPLIT_K": 1
    }
  },
  "32": {
    "stage1": {
      "BLOCK_SIZE_M": 16,
      "BLOCK_SIZE_N": 32,
      "BLOCK_SIZE_K": 64,
      "GROUP_SIZE_M": 1,
      "num_warps": 4,
      "num_stages": 3,
      "pipeline": "basic",
      "scenario": "",
      "ACCF32": false,
      "SPLIT_K": 1
    },
    "stage2": {
      "BLOCK_SIZE_M": 16,
      "BLOCK_SIZE_N": 32,
      "BLOCK_SIZE_K": 64,
      "GROUP_SIZE_M": 1,
      "num_warps": 4,
      "num_stages": 3,
      "pipeline": "basic",
      "scenario": "",
      "ACCF32": false,
      "SPLIT_K": 1
    }
  },
  "64": {
    "stage1": {
      "BLOCK_SIZE_M": 16,
      "BLOCK_SIZE_N": 64,
      "BLOCK_SIZE_K": 64,
      "GROUP_SIZE_M": 1,
      "num_warps": 4,
      "num_stages": 3,
      "pipeline": "basic",
      "scenario": "",
      "ACCF32": false,
      "SPLIT_K": 1
    },
    "stage2": {
      "BLOCK_SIZE_M": 16,
      "BLOCK_SIZE_N": 64,
      "BLOCK_SIZE_K": 64,
      "GROUP_SIZE_M": 1,
      "num_warps": 4,
      "num_stages": 3,
      "pipeline": "basic",
      "scenario": "",
      "ACCF32": false,
      "SPLIT_K": 1
    }
  },
  "128": {
    "stage1": {
      "BLOCK_SIZE_M": 16,
      "BLOCK_SIZE_N": 64,
      "BLOCK_SIZE_K": 64,
      "GROUP_SIZE_M": 1,
      "num_warps": 4,
      "num_stages": 3,
      "pipeline": "basic",
      "scenario": "",
      "ACCF32": false,
      "SPLIT_K": 1
    },
    "stage2": {
      "BLOCK_SIZE_M": 16,
      "BLOCK_SIZE_N": 64,
      "BLOCK_SIZE_K": 64,
      "GROUP_SIZE_M": 1,
      "num_warps": 4,
      "num_stages": 3,
      "pipeline": "basic",
      "scenario": "",
      "ACCF32": false,
      "SPLIT_K": 1
    }
  },
  "256": {
    "stage1": {
      "BLOCK_SIZE_M": 32,
      "BLOCK_SIZE_N": 64,
      "BLOCK_SIZE_K": 64,
      "GROUP_SIZE_M": 1,
      "num_warps": 8,
      "num_stages": 3,
      "pipeline": "basic",
      "scenario": "",
      "ACCF32": false,
      "SPLIT_K": 1
    },
    "stage2": {
      "BLOCK_SIZE_M": 32,
      "BLOCK_SIZE_N": 64,
      "BLOCK_SIZE_K": 64,
      "GROUP_SIZE_M": 1,
      "num_warps": 8,
      "num_stages": 3,
      "pipeline": "basic",
      "scenario": "",
      "ACCF32": false,
      "SPLIT_K": 1
    }
  },
  "512": {
    "stage1": {
      "BLOCK_SIZE_M": 64,
      "BLOCK_SIZE_N": 64,
      "BLOCK_SIZE_K": 64,
      "GROUP_SIZE_M": 1,
      "num_warps": 8,
      "num_stages": 3,
      "pipeline": "basic",
      "scenario": "",
      "ACCF32": false,
      "SPLIT_K": 1
    },
    "stage2": {
      "BLOCK_SIZE_M": 64,
      "BLOCK_SIZE_N": 64,
      "BLOCK_SIZE_K": 64,
      "GROUP_SIZE_M": 1,
      "num_warps": 8,
      "num_stages": 3,
      "pipeline": "basic",
      "scenario": "",
      "ACCF32": false,
      "SPLIT_K": 1
    }
  },
  "1024": {
    "stage1": {
      "BLOCK_SIZE_M": 128,
      "BLOCK_SIZE_N": 128,
      "BLOCK_SIZE_K": 64,
      "GROUP_SIZE_M": 1,
      "num_warps": 8,
      "num_stages": 3,
      "pipeline": "basic",
      "scenario": "",
      "ACCF32": false,
      "SPLIT_K": 1
    },
    "stage2": {
      "BLOCK_SIZE_M": 128,
      "BLOCK_SIZE_N": 128,
      "BLOCK_SIZE_K": 64,
      "GROUP_SIZE_M": 1,
      "num_warps": 8,
      "num_stages": 3,
      "pipeline": "basic",
      "scenario": "",
      "ACCF32": false,
      "SPLIT_K": 1
    }
  },
  "2048": {
    "stage1": {
      "BLOCK_SIZE_M": 128,
      "BLOCK_SIZE_N": 128,
      "BLOCK_SIZE_K": 64,
      "GROUP_SIZE_M": 1,
      "num_warps": 8,
      "num_stages": 2,
      "pipeline": "basic",
      "scenario": "",
      "ACCF32": false,
      "SPLIT_K": 1
    },
    "stage2": {
      "BLOCK_SIZE_M": 128,
      "BLOCK_SIZE_N": 128,
      "BLOCK_SIZE_K": 64,
      "GROUP_SIZE_M": 1,
      "num_warps": 8,
      "num_stages": 2,
      "pipeline": "basic",
      "scenario": "",
      "ACCF32": false,
      "SPLIT_K": 1
    }
  }
}