vllm_metax/model_executor/layers/fused_moe/configs/H=4096/H=4096,E=128,N=96,device_name=MXC500.json
{
    "256": {
        "stage1": {
            "BLOCK_SIZE_M": 32,
            "BLOCK_SIZE_N": 64,
            "BLOCK_SIZE_K": 64,
            "GROUP_SIZE_M": 1,
            "num_warps": 8,
            "num_stages": 4,
            "pipeline": "basic",
            "scenario": "",
            "ACCF32": false,
            "SPLIT_K": 1
        },
        "stage2": {
            "BLOCK_SIZE_M": 32,
            "BLOCK_SIZE_N": 128,
            "BLOCK_SIZE_K": 32,
            "GROUP_SIZE_M": 16,
            "num_warps": 4,
            "num_stages": 3,
            "pipeline": "cpasync",
            "scenario": "unroll",
            "ACCF32": false,
            "SPLIT_K": 1
        }
    },
    "512": {
        "stage1": {
            "BLOCK_SIZE_M": 64,
            "BLOCK_SIZE_N": 64,
            "BLOCK_SIZE_K": 64,
            "GROUP_SIZE_M": 1,
            "num_warps": 4,
            "num_stages": 2,
            "pipeline": "cpasync",
            "scenario": "",
            "ACCF32": false,
            "SPLIT_K": 1
        },
        "stage2": {
            "BLOCK_SIZE_M": 64,
            "BLOCK_SIZE_N": 128,
            "BLOCK_SIZE_K": 32,
            "GROUP_SIZE_M": 16,
            "num_warps": 4,
            "num_stages": 3,
            "pipeline": "cpasync",
            "scenario": "unroll",
            "ACCF32": false,
            "SPLIT_K": 1
        }
    },
    "1024": {
        "stage1": {
            "BLOCK_SIZE_M": 64,
            "BLOCK_SIZE_N": 64,
            "BLOCK_SIZE_K": 64,
            "GROUP_SIZE_M": 1,
            "num_warps": 4,
            "num_stages": 2,
            "pipeline": "cpasync",
            "scenario": "",
            "ACCF32": false,
            "SPLIT_K": 1
        },
        "stage2": {
            "BLOCK_SIZE_M": 64,
            "BLOCK_SIZE_N": 256,
            "BLOCK_SIZE_K": 32,
            "GROUP_SIZE_M": 1,
            "num_warps": 4,
            "num_stages": 1,
            "pipeline": "basic",
            "scenario": "",
            "ACCF32": false,
            "SPLIT_K": 1
        }
    },
    "1536": {
        "stage1": {
            "BLOCK_SIZE_M": 128,
            "BLOCK_SIZE_N": 128,
            "BLOCK_SIZE_K": 128,
            "GROUP_SIZE_M": 1,
            "num_warps": 4,
            "num_stages": 4,
            "pipeline": "cpasync",
            "scenario": "storeCoalesce",
            "ACCF32": false,
            "SPLIT_K": 1
        },
        "stage2": {
            "BLOCK_SIZE_M": 128,
            "BLOCK_SIZE_N": 128,
            "BLOCK_SIZE_K": 32,
            "GROUP_SIZE_M": 1,
            "num_warps": 4,
            "num_stages": 1,
            "pipeline": "cpasync",
            "scenario": "unroll",
            "ACCF32": false,
            "SPLIT_K": 1
        }
    },
    "2048": {
        "stage1": {
            "BLOCK_SIZE_M": 128,
            "BLOCK_SIZE_N": 128,
            "BLOCK_SIZE_K": 128,
            "GROUP_SIZE_M": 1,
            "num_warps": 4,
            "num_stages": 4,
            "pipeline": "cpasync",
            "scenario": "storeCoalesce",
            "ACCF32": false,
            "SPLIT_K": 1
        },
        "stage2": {
            "BLOCK_SIZE_M": 128,
            "BLOCK_SIZE_N": 128,
            "BLOCK_SIZE_K": 32,
            "GROUP_SIZE_M": 1,
            "num_warps": 4,
            "num_stages": 1,
            "pipeline": "cpasync",
            "scenario": "storeCoalesce",
            "ACCF32": false,
            "SPLIT_K": 1
        }
    },
    "4096": {
        "stage1": {
            "BLOCK_SIZE_M": 128,
            "BLOCK_SIZE_N": 128,
            "BLOCK_SIZE_K": 128,
            "GROUP_SIZE_M": 16,
            "num_warps": 4,
            "num_stages": 4,
            "pipeline": "cpasync",
            "scenario": "",
            "ACCF32": false,
            "SPLIT_K": 1
        },
        "stage2": {
            "BLOCK_SIZE_M": 128,
            "BLOCK_SIZE_N": 128,
            "BLOCK_SIZE_K": 32,
            "GROUP_SIZE_M": 1,
            "num_warps": 4,
            "num_stages": 1,
            "pipeline": "basic",
            "scenario": "",
            "ACCF32": false,
            "SPLIT_K": 1
        }
    },
    "8192": {
        "stage1": {
            "BLOCK_SIZE_M": 128,
            "BLOCK_SIZE_N": 128,
            "BLOCK_SIZE_K": 128,
            "GROUP_SIZE_M": 1,
            "num_warps": 4,
            "num_stages": 4,
            "pipeline": "cpasync",
            "scenario": "",
            "ACCF32": false,
            "SPLIT_K": 1
        },
        "stage2": {
            "BLOCK_SIZE_M": 128,
            "BLOCK_SIZE_N": 128,
            "BLOCK_SIZE_K": 32,
            "GROUP_SIZE_M": 1,
            "num_warps": 4,
            "num_stages": 1,
            "pipeline": "basic",
            "scenario": "storeCoalesce",
            "ACCF32": false,
            "SPLIT_K": 1
        }
    }
}